{
  "$schema": "./interactions.schema.json",
  "about": "P207: the single source of truth for every mouse / touch gesture and keyboard shortcut of the Agent J web app. Never edit the generated files; add an entry with `agentjarvis/tools/interactions add`, then `render`; `check` runs in the p44 gates.",
  "next_version": "0.20.2",
  "words": {
    "hold": {
      "zh": "按住",
      "en": "hold"
    },
    "space": {
      "zh": "空格",
      "en": "Space"
    },
    "gesture": {
      "zh": "鼠标 / 触摸：",
      "en": "Mouse / touch: "
    }
  },
  "groups": [
    {
      "id": "page",
      "zh": "翻页",
      "en": "Pages"
    },
    {
      "id": "card",
      "zh": "当前回复卡",
      "en": "This reply"
    },
    {
      "id": "file",
      "zh": "这一页的文件",
      "en": "Files on this page"
    },
    {
      "id": "app",
      "zh": "页面顶部与状态",
      "en": "Header and status"
    },
    {
      "id": "compose",
      "zh": "输入框与附件",
      "en": "Message box and attachments"
    },
    {
      "id": "read",
      "zh": "全屏阅读",
      "en": "Full-screen reader"
    },
    {
      "id": "viewer",
      "zh": "文件预览",
      "en": "File preview"
    },
    {
      "id": "search",
      "zh": "搜索聊天记录",
      "en": "Search the chat"
    },
    {
      "id": "appr",
      "zh": "审批卡",
      "en": "Approval card"
    }
  ],
  "entries": [
    {
      "id": "page.prev",
      "since": "0.15.0",
      "impl": "table",
      "scope": "chat",
      "repeat": false,
      "target": {
        "selector": "#deck",
        "zh": "消息卡",
        "en": "Message cards"
      },
      "gestures": [
        {
          "type": "swipe-right",
          "pointer": "touch"
        },
        {
          "type": "tap",
          "pointer": "any",
          "on": "#pgPrev"
        }
      ],
      "keys": [
        {
          "combo": "j"
        },
        {
          "combo": "ArrowLeft"
        }
      ],
      "zh": "上一条（更早）",
      "en": "Previous page (older)",
      "gesture_zh": "卡片向右滑；横屏点左边的 ‹",
      "gesture_en": "Swipe the cards right; in landscape tap ‹ on the left",
      "common": true
    },
    {
      "id": "page.next",
      "since": "0.15.0",
      "impl": "table",
      "scope": "chat",
      "target": {
        "selector": "#deck",
        "zh": "消息卡",
        "en": "Message cards"
      },
      "gestures": [
        {
          "type": "swipe-left",
          "pointer": "touch"
        },
        {
          "type": "tap",
          "pointer": "any",
          "on": "#pgNext"
        }
      ],
      "keys": [
        {
          "combo": "k"
        },
        {
          "combo": "ArrowRight"
        }
      ],
      "zh": "下一条（更新）",
      "en": "Next page (newer)",
      "gesture_zh": "卡片向左滑；横屏点右边的 ›",
      "gesture_en": "Swipe the cards left; in landscape tap › on the right",
      "common": true
    },
    {
      "id": "page.newest",
      "since": "0.17.0",
      "impl": "table",
      "scope": "chat",
      "target": {
        "selector": "#pgLatest",
        "zh": "消息卡页眉右边 1/3（页码）",
        "en": "Right third of the message card header (page number)"
      },
      "gestures": [
        {
          "type": "double-tap",
          "pointer": "any"
        },
        {
          "type": "tap",
          "pointer": "any",
          "when": "the page number flashes"
        }
      ],
      "keys": [
        {
          "combo": "g"
        }
      ],
      "zh": "跳到最新一条",
      "en": "Jump to the newest page",
      "gesture_zh": "双击页眉右边 1/3（页码）；页码闪烁时单击也行",
      "gesture_en": "Double-tap the right third of the header (page number); a single tap while it flashes",
      "common": true
    },
    {
      "id": "page.earliest",
      "since": "0.17.0",
      "impl": "table",
      "scope": "chat",
      "target": {
        "selector": "#omFirst",
        "zh": "消息卡页眉左边 1/3",
        "en": "Left third of the message card header"
      },
      "gestures": [
        {
          "type": "double-tap",
          "pointer": "any"
        }
      ],
      "keys": [
        {
          "combo": "G"
        }
      ],
      "zh": "跳到最早一条（更早的会从电脑上取）",
      "en": "Jump to the earliest page (older ones are fetched from the computer)",
      "gesture_zh": "双击页眉左边 1/3",
      "gesture_en": "Double-tap the left third of the header",
      "common": true
    },
    {
      "id": "page.first_unread",
      "since": "0.20.2",
      "impl": "table",
      "scope": "chat",
      "target": {
        "selector": "#omUnread",
        "zh": "消息卡页眉中间 1/3（未读圆标）；左上角 logo",
        "en": "Middle third of the message card header (unread badge); the logo at the top left"
      },
      "gestures": [
        {
          "type": "tap",
          "pointer": "any",
          "on": "#omUnread"
        },
        {
          "type": "long-press",
          "pointer": "any",
          "on": "#orb"
        }
      ],
      "keys": [
        {
          "combo": "u"
        }
      ],
      "zh": "跳到第一条未读（这台设备上次看到之后才来的回复），再一张张往后翻",
      "en": "Jump to the first unread reply (arrived after this device last saw the page), then page forward",
      "gesture_zh": "点页眉中间 1/3 的未读圆标；或者长按左上角 logo",
      "gesture_en": "Tap the unread badge in the middle third of the header, or hold the logo at the top left",
      "common": true
    },
    {
      "id": "page.quoted",
      "since": "0.20.2",
      "impl": "table",
      "scope": "chat",
      "target": {
        "selector": "#omQuote",
        "zh": "原话里引用的那一条",
        "en": "The quoted message inside a message"
      },
      "gestures": [
        {
          "type": "tap",
          "pointer": "any"
        }
      ],
      "keys": [
        {
          "combo": "q"
        }
      ],
      "zh": "跳到这一条引用的那条消息",
      "en": "Jump to the message this one quotes",
      "gesture_zh": "点原话上方的引用条",
      "gesture_en": "Tap the quote above the message"
    },
    {
      "id": "page.expand",
      "since": "0.15.0",
      "impl": "table",
      "scope": "chat",
      "repeat": true,
      "target": {
        "selector": "#om",
        "zh": "原话卡",
        "en": "Message card"
      },
      "gestures": [
        {
          "type": "tap",
          "pointer": "any",
          "on": "#omMore"
        },
        {
          "type": "double-tap",
          "pointer": "any",
          "on": "#omText"
        }
      ],
      "keys": [
        {
          "combo": "o"
        },
        {
          "combo": "ArrowUp"
        },
        {
          "combo": "ArrowDown"
        }
      ],
      "zh": "展开 / 收起原话（↑ 展开，↓ 收起；没有可展开的时候 ↑ ↓ 在消息里滚一段）",
      "en": "Expand / fold the message (↑ expands, ↓ folds; with nothing to toggle ↑ ↓ scroll the page)",
      "gesture_zh": "点右边的 … 按钮；双击原话",
      "gesture_en": "Tap the … button on the right; double-tap the message",
      "common": true
    },
    {
      "id": "page.scroll",
      "since": "0.15.0",
      "impl": "table",
      "scope": "chat",
      "repeat": true,
      "target": {
        "selector": "#main",
        "zh": "回复卡",
        "en": "Reply card"
      },
      "gestures": [
        {
          "type": "scroll",
          "pointer": "any"
        }
      ],
      "keys": [
        {
          "combo": "Space"
        },
        {
          "combo": "Shift+Space"
        }
      ],
      "zh": "往下翻一屏（Shift+空格 往上）",
      "en": "Scroll down one screen (Shift+Space up)",
      "gesture_zh": "上下滑动回复",
      "gesture_en": "Scroll the reply"
    },
    {
      "id": "card.reader",
      "since": "0.15.0",
      "impl": "table",
      "scope": "chat",
      "target": {
        "selector": "#readBtn",
        "zh": "回复卡底部「全屏阅读」",
        "en": "Reply bar: full-screen reader"
      },
      "gestures": [
        {
          "type": "tap",
          "pointer": "any"
        },
        {
          "type": "double-tap",
          "pointer": "any",
          "on": "#rm"
        }
      ],
      "keys": [
        {
          "combo": "f"
        }
      ],
      "zh": "全屏阅读这条回复",
      "en": "Read this reply full screen",
      "gesture_zh": "点书本图标；双击回复",
      "gesture_en": "Tap the book icon; double-tap the reply",
      "common": true
    },
    {
      "id": "card.speak",
      "since": "0.20.2",
      "impl": "table",
      "scope": "chat",
      "target": {
        "selector": "#speakBtn",
        "zh": "回复卡底部「朗读」",
        "en": "Reply bar: read aloud"
      },
      "gestures": [
        {
          "type": "tap",
          "pointer": "any"
        }
      ],
      "keys": [
        {
          "combo": "l"
        }
      ],
      "zh": "朗读这条回复（再按一次停下）",
      "en": "Read this reply aloud (press again to stop)",
      "gesture_zh": "点喇叭图标",
      "gesture_en": "Tap the speaker icon"
    },
    {
      "id": "card.forward",
      "since": "0.20.2",
      "impl": "table",
      "scope": "chat",
      "target": {
        "selector": "#fwdBtn",
        "zh": "回复卡底部「转发给我自己」",
        "en": "Reply bar: forward to myself"
      },
      "gestures": [
        {
          "type": "tap",
          "pointer": "any"
        }
      ],
      "keys": [
        {
          "combo": "t"
        }
      ],
      "zh": "把这条回复转发给自己（没设置转发时用手机的分享）",
      "en": "Forward this reply to yourself (the phone's share sheet when forwarding is not set up)",
      "gesture_zh": "点箭头图标",
      "gesture_en": "Tap the arrow icon"
    },
    {
      "id": "card.mail",
      "since": "0.20.2",
      "impl": "table",
      "scope": "chat",
      "target": {
        "selector": "#mailBtn",
        "zh": "回复卡底部「转发到邮箱」",
        "en": "Reply bar: forward by e-mail"
      },
      "gestures": [
        {
          "type": "tap",
          "pointer": "any"
        }
      ],
      "keys": [
        {
          "combo": "e"
        }
      ],
      "zh": "把这一条转发到邮箱（邮件通道打开时才有）",
      "en": "Forward this one by e-mail (when the e-mail channel is on)",
      "gesture_zh": "点信封图标",
      "gesture_en": "Tap the envelope icon"
    },
    {
      "id": "card.copy",
      "since": "0.15.0",
      "impl": "table",